Adidas,2024-03-24,"First off, I want to start off with the positives. The shoe itself looks amazing and very sporty. The gray and silver colors offset by the neon orange sole and interior looks fantastic. As far as comfort goes, the generous sole thickness makes for pleasant walking, hiking, and even gym-use. My only complaint about the shoe is that the insoles themselves are lackluster and extremely disappointing. After having the shoe for simply two weeks and after doing some extensive walking, I noticed that the insoles were slowly running up the back of my feet due to slippage. In an attempt to be creative, I replaced the insoles with the same insoles I was using in the New Balance shoes these were intended to replace. I may have created a Frankenstein shoe in the process, but no one will know or be able to see the insole replacements. The end result is a fantastic shoe with an extremely comfortable insole that no longer moves."
Adidas,2023-12-10,"Los tenis son muy bonitos, muy contento con la compra, llegaron muy rápidos, todo muy cumplido"
Adidas,2024-01-10,"Me preocupaba la talla pero me quedaron bien, ahora solo queda ver su durabilidad.ActualizacionEn el 1er día de uso  y en la parte interna se desprendió la almohadilla. A un mes de uso la suela en la parte trasera se despegó y se agujereo. Pésimo"
Adidas,2023-12-04,
Adidas,2023-11-11,First day of wearing them…. Very comfortable on the feet.
Adidas,2023-12-15,Los tennis tienen defectos y se observa la pega
Adidas,2024-03-25,"They fit great, look great, at a good price."
Adidas,2024-01-23,"I really like these shoes. They fit perfectly and are very comfortable. Also, I like that my feet don't get cold in low temps as I've had that problem with other shoes."
Adidas,2024-03-07,"The gray on the front of the shoe is more of an off-white grey. Not dark grey like in picture. Shoes are comfortable, light, and fit to size."
Adidas,2024-03-12,"My foot is shaped like the shoe box, size 12 fits my foot better than the 11 I measure. ""Pointer feet"" probably fit as sized.  Bought these to help rehab my new knee and really like them.  Tread is great on the sandy, rolling trails I prefer to walk; shoe is all day wear comfortable.  Toe bumper protects toes on trails and the forefoot is beefed up to prevent ""big toe poke through"". Wasn't sure about the color but it works in my ""casual dress code"" office."
Adidas,2024-03-18,Nice and reasonable price.
Adidas,2024-03-19,Love fit and feel
Adidas,2023-05-03,"I hike/walk these days. I had thought that I would stick with the Adidas AX style trail hiking shoes I've had, but I just returned a new pair of AX2s because the toe box on those are just too cramped.These trail runners are better up front and down below have a sole design that is more stable because they flare out, especially around the heel area.  I rolled my ankle more often on trails with the AX versions I've had.  The AX hiking shoes are also more jolting, while these are nice and cushy.The one downside, the soles rubber is soft and wears rather quickly if you have to run/walk some paved roads to get to the trail.  That said, the rest of the shoe is very durable.  My tread worn pair is still fine otherwise, even after many twig pokes and rock scrapes.Also, once the tread wears down, they are still fine for street use.  I'm saving my old pair for times when I will just be walking paved roads and don't need knobs."
Adidas,2023-10-27,"Update: After causing too much foot pain from using the trail running shoes running on trails, I've gone back to my old pair of proper trail runners. Even with a new insole these are not good trail runners for narrow D feet. Relegated now to yard work duties.----------These are supposed to be trail running shoes which should feature a snug heel and a roomy toe box. These are just your basic slightly wide regular fit.My foot is a narrow D so these are not super comfortable on the trail. If you are  a normal or wider D these should feel pretty good.The traction on rock and slippery surfaces, however, is outstanding.May see about getting a thicker insole and wearing some thicker socks to get me a snug fit. For the price (on sale) still good value if you are a normal or slightly wide D"
Adidas,2024-03-29,Fits perfect and size is as expected.  Easy to break in and very comfortable for a full 18. Highly recommend!
Adidas,2023-10-17,"Great shoe, comfortable, stylish and such a great price.  Can’t go wrong with these golf shoes"
Adidas,2024-03-31,Like the looks and tread pattern. I agree with other reviewers that they are lacking padding on the top ankle opening. Definitely need socks taller than the shoe.
Adidas,2024-04-01,"These shoes not only feel great but look great. Was not sure about spikeless golf shoes, but got to wear these on the course and it’s just what I was looking for. There styling too."
Adidas,2023-09-17,"Super light, flexible, water proof. Just like my daily runners. These run 1/2 size small. Normally I wear 9.5 Adidas, exchanged for 10. Perfect. First day out, all day 18 holes, no problem. Easy on and off. Super cushy heal pocket, outta bounce I in your step, no slipping. Love 'em."
Adidas,2023-11-14,"Bought these for my husband, who had lost his golf shoes.  Great value, great fit, great shoes!"
Adidas,2024-01-15,The product delivered was exactly what I was expecting. Good price great quality.
Adidas,2024-03-07,These will run on the front of your lower ankle. Tall socks recommended
Adidas,2024-04-08,"Super comfy, almost sock-like. I read reviews that said people couldn’t get their feet into them, but I had no issue. Definitely would buy again"
Adidas,2024-04-07,"Great fit, comfortable and stylish. Love them!"
Adidas,2023-10-31,"Fit is a bit tight initially but that is expected from a fabric - if you have super wide front of foot or fat feet they may not work.  My son has normal width feet, kind of a high arch. They fit great - and bonus for any young man they add about 13/4 in height (not me judging, just know guys like height)"
Adidas,2024-03-16,They fit perfectly
Adidas,2024-04-15,I love adidas anything. Coolest part of these bad boys is they are obviously solid red. That's why I bought em. I love the look. They are comfy and fit well. If you are a show person like I am then owning a solid red pair anybrand is a must. Buy and enjoy. You will.
Adidas,2024-04-11,"10/10 recommend! Adidas always delivers. It's about quality, supporting their mission, vision and purpose and can we just admire the vibrancy of these shooes???"
Adidas,2023-10-03,"I found the fit significantly tighter than my other shoes of the same size plus I am 83 years old and putting them on when there is a continuous piece of the shoe fabric where there usually is a tongue makes it really difficult for me, particularly my left foot which is slightly swelled sometimes. Not being able to spread the lacing area of the shoes when putting on the shoe has made it just too difficult for me to do even with long shoehorns. Because they are tight (even though all my good fitting shoes are the same US size as these so they should fit well) walking in them is not pleasant. Also, after wearing them with their very thick sole in the back, I have to assume that they were not made for men but really were made for ladies used to walking in high heels. I am giving them away and definitely will not purchase this style of shoe again."
Adidas,2024-03-08,"The shoes look excellent. I ordered 5 pairs total attempting to find the correct size for myself and my son. Turns out the issue isn't the shoe size. It's the opening you put your foot in. It is massively undersized, and since it isn't a typical tongue style shoe it can't be loosened or adjusted. I'm not skinny, but my son is. Neither of us could find a comfortable size"
Adidas,2023-07-31,"I wanted some non expensive spike-less golf shoes that still looked good. I’ve always been a fan of adidas so these looked great! Playing 5 rounds with them so far has been great! Being that they’re spike less, they don’t have outstanding grip in rain/mud. However, they do wash off and clean up really nice. They’re also durable enough to wear to the course and walk around on concrete. They’re stylish enough to wear out if you go to Topgolf or something that. My only complaint is they’re a little warm for Texas 115 degree weather, but that doesn’t even take it down from 5 stars."
Adidas,2023-12-26,These are the most comfortable golf shoes I have ever owned. they feel like your wearing slippers. I highly recommend them.
Adidas,2023-07-06,I bought these shoes for a trip to Europe. They survived 10+ daily mile walks. My feet didn’t hurt at the end of the day either. Needless to say they are broken in.
Adidas,2023-08-03,"Read the fine print, this is not a sneaker."
Adidas,2023-11-29,got a great deal on BF. The price went up afterward. Glad that I bought one.
Adidas,2023-12-21,"These shoes are really comfortable and great for a range session or a day on the course. However, the grass must be dry. If you are playing in the early morning or with some rain, the grip on these soles will not do the job so stick to spikes if you deal with a lot of rain or like to play early in the morning. Otherwise these shoes are amazing. Good casual spikeless shoe that is arguably more comfortable than any other shoe I own."
Adidas,2023-06-22,Great shoe by far my favorite golf shoe yet
Adidas,2023-08-26,"These are comfortable and really nice looking. They are easy to clean and the quality is great, hard to be Adidas!"
Adidas,2024-04-02,The shoes are very comfortable
Adidas,2023-09-04,"Bought these to replace my old Adidas that I’ve worn for about 12-14 years after the sole came off.  These are almost identical, lightweight, great grip during swings, and extremely comfortable.  Size is perfect."
Adidas,2024-03-31,Getting harder to find golf shoes with changeable cleats! Well worth the money!
Adidas,2023-12-09,The shoe looks and performs fine but the materials are a little cheap and they crease where the toe bends in a very stiff and uncomfortable way that does not yet seem to be breaking in. So far I'm happy with them as other than that they are comfortable and they look good for the money but if they don't soften up in the crease they will continue to be very uncomfortable.
Adidas,2024-02-02,"Size was perfect, fast delivery (even for Puerto Rico). Great shoes for the price."
Adidas,2023-12-30,Absolutely amazing with a great grip in both dry and wet weather!!
Adidas,2024-01-24,"I have a very old set of Adidas Tech golf shoes and got these as a backup after regluing the sole of my older set.The fit is similar, but the materials feel cheaper. The best way I can describe it is that it feels like a cheap set of fake leather shoes - but not the whole shoe, just parts of it. Time will tell how it holds up, but my initial impressions are not great."
Adidas,2023-11-29,These are extremely comfortable on my high school golfer who walks 18 holes and Carrie’s his bag. They are sturdy and keep his feet dry in the morning dew.
Adidas,2023-12-15,This shoe design is great. The shoes fit my wide feet well. The shoe is light. I wear this shoe at work in an office clinic setting and it is comfortable on my feet all day long. Only gripe is that the shoe insole that it comes with wears out rather quickly.
Adidas,2024-03-31,nice
Adidas,2024-03-20,"I got this sneakers and few, also Adidas, similar stile and design.  This sneakers are super light, have no shoelaces and on gray color is hard to see dust or dirt. Only one problem is insoles,  they don't last too long, but you can get them for cheap on internet and they will be good quality.."
Adidas,2024-04-15,"These are wonderful if you plan on using them indoors for a few months and then replacing them again. They're like wearing comfortable socks. They're very nice and lightweight, but the issue lies within the bottoms of these shoes.. the traction.. It's already pretty thin so it won't take much to turn these into slippers. I really enjoy how stylish these are and how easy they are to use as walking shoes, but this one detail really hurts their credibility in my opinion. If it wasn't for all the positives, I'd drop it down further on my rating. During the few months that these shoes are in great condition, you will absolutely love them."
Adidas,2024-03-08,Son lives in these. Easy slip on and off with no wear to the back.
Adidas,2024-03-17,"As a mostly remote (at home) worker these are my new go-to 'office' shoes. They are very comfortable and can wear all day without issues. I haven't tried exercising in these shoes. Not sure if the tops, without laces, would be supportive enough."
Adidas,2024-01-08,"My husband and I are both amputees (my left leg, his right). We struggle big time with shoes, we have found that this shoe is easy to get on and off with the least amount of effort. Definitely a good purchase for us. The only con I have with this product is that there isn't a style available similar to this that is waterproof. If I could change anything about the shoe it would be just to make it hold up to the elements a bit better. we wear through them rather quickly because the material isn't as durable as it should be, in my opinion."
Adidas,2024-02-28,"Slip on running shoe.  I know that they should stay on, but they are very snug. Pulls your sock up when trying to get then on.  Once situated,  these shoes are very comfortable and light."
Adidas,2024-01-09,"These golf shoes are comfortable and provide good support.  They look like tennis shoes - as opposed to golf shoes. I did go up a half a size, and the fit is perfect.  The spikes are pretty large, and I feel like they kind of leave marks on the greens. I walk very carefully."
Adidas,2023-11-14,"These golf shoes are perfect!  They fit perfectly, I could walk all day in them as they are so very comfortable!  I will definitely purchase them again!"
Adidas,2023-10-02,"I'm newer to the sport of golf and needed a shoe to get me started. These shoes are very comfortable and have a great material to keep your feet dry! For the price, this is a great shoe to start with."
Adidas,2023-10-29,"Felt stiff but based on other reviews, it needs to be broken into. I haven't use this item on the golf course yet so I cannot say anything else about it."
Adidas,2024-01-09,toe is a bit narrow. - nice shoe!
Adidas,2024-03-31,I absolutely love these and they have became my favorite. I always order a half size larger in any golf shoe and these were no different. They are perfect.
Adidas,2023-11-27,I wore these new out of the box thus past weekend at Talamore Golf Resort. Golfed 3 days straight and these were the most comfortable golf shoes ever!  I would recommend anyone purchasing them. They were true to size.
Adidas,2023-08-30,Bought to have an extra pair of golf shoes. When I purchased them thinking they were not waterproof. Wore them last evening for league play thinking it wouldn't rain. WRONG! Downpour for 15 minutes. These shoes were WATERPROOF.  My feet were dry by the time I got to the clubhouse. Wonderful golf shoes for rain. Very comfortable. The size fit perfectly without getting a 7.5. wide.
Adidas,2024-01-08,"I've always been a fan of Adidas and the reason is they make comfortable quality shows at a great price. These are stylish, with god comfort, and a unique design.  I wasn't disappointed and they came in great condition and delivery was as expected. I can tell you how nice these shoes look and I've got my wardrobe in place already. What I like about these is that they're easy to slip on and off, they're, light weight, and they are a good fit. They have a nice hug around the ankle and they are true size so stick with my normal size and I have about 1/2"" cushion which gives me great comfort. You don't have to worry about the shoe coming off as it fits like a glove, so you can run, jump, or workout in these with no issues. The best thing about these shoes is the style, and then in a strong 2nd is the comfort. I own multiple pair of Adidas and these are just as comfortable as my older ones with a nice look. I don't have a call out for anything I didn't like I love Adidas and that's a fact."
Adidas,2024-03-24,Easy to put on. No laces to tie. Minimalistic simple design. Ordered the size 7.5 and it's true to size. Very comfy.
Adidas,2024-03-10,My original ultra boost got worn out for the years I had worn it. These fit true and is comfortable for a long period of time. As well as a great gym shoes
Adidas,2023-12-28,These are comfortable and great looking shoes.The slip on feature is nice and they feel tight on the foot once put on.I will advise to get at least a 1/2 size larger than a normal shoe. If the shoes are too tight in the toe you will see the outlines of your toes. It is not the best look!
Adidas,2023-12-10,"Very comfortable for everyday use, running, sports or gym use. They might have a tighter foot entrance than you're use to (if you haven't worn similar ones before) but not to worry, it's just tighter to make sure they stay on your feet. I have been buying this style of shoe from adidas for a few years now and I've been loving them. Very durable shoe as well. I've been using one of the pairs for 3 years as a work shoe (it's not one but I use it as one) and the shoe is in great condition considering it's a more labor intensive job and always on my feet. So I'd say these will last you a good amount of time and while having a good look and feel."
Adidas,2024-04-04,love the shoe very comfortable and extremely light weight
Adidas,2024-03-28,Wear these as my house shoes. Easy slip on. Very comfy. They are great.
Adidas,2024-03-28,My grandson loves them n says they are very comfortable
Adidas,2023-09-21,"After being in use of these for a couple months, these quickly became my favorite shoes in general above others! ADIDAS has always been my go-to shoes for just fashion and basic comfort, Forums in all forms are my personal favorite, and then I got these Grand Court 2s for long standing at work. All-in-all, I can best express my feelings to these as stylish, comfortable, and quite durable in the long run because they look great in basic all black and are the easiest to clean and shine after work. I often use these when I'm out shopping and visiting friends as well, I'm just that confident in these as comfort shoes and I have some decently wide feet as well. Since I have them in all black, the creases don't really show up when you are not actively looking for them, which is a plus and to add to that, it barely creases when casually walking. I was also told to size up by another half for better fitting, which I did, and I can still feel a bit of extra toe room as I slide my feet in.At the end of the day, it's definitely my favorite everyday shoes when I'm not over thinking about style and comfort. It's so good I would actually recommend this at base price, but I did catch these shoes at 30% lower so if it goes on sale, I wouldn't hesitate at the thought of buying these."
Adidas,2024-01-09,"I bought this court shoe for my husband to play pickleball on outdoor courts, and he likes it.  I would say it's true to size because he told my what size shoe he wears, I ordered that size, and he said it fits fine, no problems.  His feet are average width.  I call them his ""Run DMC"" shoes because it reminds me of the style of shoes Run DMC wore on MTV.  I can tell he loves the shoes because he is careful not to get them dirty and cleans them after every use.  He does not do that as much with his other athletic shoes.  He speculated that the shoes MAY have had some kind of slippery-type ""finish"" on the bottom of the shoes, because the first time he wore them, he slid on the court several times and actually fell, BUT the court may have had light/not visible moss on it from a prior rain.  He is very athletic so he didn't fall because he's old or out of shape.  Since that first time using the shoes about a month and a half ago, he hasn't slid or fallen since.  I knocked off a star for ""value for money"" because supposedly it was a deal at just under $63 but after that, about a month later, the price dropped to under $45.  I hate when that happens, ugh!  Anyway, I hope you found this review helpful because it's hard to buy shoes online since you can't try them on first."
Adidas,2024-04-14,I love my adidas Grand Court 2.0. I usually go with the Adidas Superstars but these are just as good withsome minor design differences. I did have to got up a a full size as they were a tighter fit than the Adidas Superstars. They are comfortable to wear and go with any outfit.
Adidas,2024-02-23,I tried the Air Force Ones but didn’t love the fit and they were difficult to walk in. These are a GREAT option for a similar look! Very comfortable to walk in and they fit perfectly to size.
Adidas,2023-08-02,"I love the look, the fit, and the comfort of Adidas shoes. These are attractive shoes, solid, white, with the three burgundy stripes. The only complaint that I have is that they arrived in a white bag with the shoebox inside. The shoebox was completely crushed and mangled. Not so much a problem for me, because it was going in the trash, but for some shoe collectors, the box is just as important as what’s inside."
Adidas,2024-04-07,Great product. I use them for work
Adidas,2024-04-02,Fit perfect great for anyone that wants a comfy cheap durable shoe
Adidas,2024-02-23,"Just what I expect from Adidas... A too quality shoe full of comfort and awesome looks. I have several pairs of Superstars and while I love them, especially for the old school look, these are definitely MUCH more comfortable. I mean, the in-sole is fantastic! Gel and crazy comfortable. I'll definitely be buying more"
Adidas,2024-02-29,"Just got these back after a year hiatus. Perfect shoes for basic, neutral stylin' around town. Pretty much will go well with anything your wearing. The soles are white and will last forever and don't scuff: they wear evenly well. I paid like $10 more at Shoe Carnival 3 years ago, so these are a steal and the price is still going down a week later. BUY these. They look good for at the beach, bar, work/office, airport.. I'm probably end up buying another pair for strictly inside around the house to keep the carpets clean, and one for nights on the town as these have been my everyday walking shoes. Downside is, the whitewalls of the soles of the shoes will show ANYTHING that get up there, so I'll wipe them with a Mr. Clean magic eraser once a week to keep them fresh looking (also, being former army, I know ""if you take care of your gear, your gear will take care of you"" 😋); also another reason I'm buying a pair for around the house, etc. Get them now, they are an investment and will last year's if you keep them clean. Will shrink slightly if you machine wash them. Air-dry with hairdryer or in the direst sun"
Adidas,2024-02-27,"I love these shoes. I thought I’d have to break these shoes in, but they fit perfectly and comfortably immediately. I typically wear a size 11, which is the size I purchased, and they were true to fit. These have a classic style that I can wear as everyday shoes. I’d absolutely buy another pair."
Adidas,2024-03-30,"They look nice and fit comfortably, perfect casual walking shoe."
Adidas,2024-03-03,"The insoles that come with these are barely thicker than construction paper, and offer zero support. Add your choice of quality insoles and you'll have a 5 star pair of shoes. This is the first time I have ever been disappointed in an Adidas product; I remedied the situation but wish I hadn't had to spend the extra money."
Adidas,2024-04-15,"I'm a teacher, so I'm on my feet a decent amount of the day and, so far, these shoes have been amazing. Incredibly comfortable with an almost molded soul, great tread, and stylish looking. I often get compliments from my colleagues and students (who can be very picky with what they like) on my shoes. These are my go to shoes for work or everyday now. Also a plus that it is a well known name like Adidas who has been making quality products for years and years now."
Adidas,2024-03-09,Fits true to size and don’t even have to break the shoe in. Great classic Adidas look. Completely satisfied with the shoes.
Adidas,2024-04-14,"I adore these shoes. For the price, they’re very comfortable and I love the way they look."
Adidas,2024-02-28,"I've been looking for something of a modern style mixed with a classic feel - this shoe is definitely it. It's comfortable, stylish, and i didn't break the bank buying a $100+ shoe. The shoe fits true to size in my experience and i have a wider foot. Would highly recommend!"
Adidas,2024-04-09,These were on sale so I thought to give them a try. Very light weight and comfortable. Had good ground contact and stability. Amazon recommended a half size larger which I did and they fit perfectly. I’m normally a 10.5 in men’s boots and shoes but 11 are just right. These have a really nice look and descent quality
Adidas,2024-03-03,"Love everything about these shoes.Best shoes I have ever owned.Lightweight, comfortable, functional and best of all a great price!"
Adidas,2024-03-19,"This was the first time I had bought this brand of golf shoes. They are very comfortable, and appear to be of very good quality. If I had a complaint, it would be that the soles retain too much dirt and are a little difficult to clean."
