Skechers,2024-02-09,"I bought these for my father, he is 87 and has swollen feet from medication.  He loves the fact he can just step right into them.  Says they are comfortable also.  May buy another pair in a different color."
Skechers,2024-02-23,Excellent shoes.  I had purchased the exact shoe before and they were great and easy to slip in and out. I did unfortunately select a wide size but should have stayed with the regular width. My fault. Sizes run true. Returned them but wouldn’t hesitate to purchase this shoe design in the future.
Skechers,2024-04-16,"These are comfortable, light weight walking shoes, I think a good buy for the money and true to size.  I am walking 2-3 miles a day and  they seem to be holding up well"
Skechers,2023-04-02,The only Shoes I wear.
Skechers,2024-03-23,These Skechers are just really comfortable and a perfect fit. I usually take a size10 in skechers sandals and shoes but find I need a size up for training shoes.  These ate fabulous walking shoes as they offer great support and cushioning for the feet ... I  recommend these trainers ... you won't be disappointed.
Skechers,2022-03-27,Just received these a few days ago. I have only worn them in the house so far due to recent rain.I ordered a half size up and they are really comfortable and lightweight. Traction on sole is also good. Ready to enjoy spring morning walks!
Skechers,2024-03-27,Sketchers never disappoints. Subtle style with a lot of comfort.
Skechers,2023-03-02,Extremely comfortable!
Skechers,2024-03-28,"These walking shoes are very comfortable, but I have to size up! I'm a true 7.5 with medium width feet and ordered these in 7.5 regular. Wearing exercise socks, my toes reached all the way to the end of the shoe and my pinky toes were slightly pressed in. There was no wiggle room at all.I'm going for size 8!"
Skechers,2020-09-23,"This is my second pair of Sketchers Go Walk and they are the most comfortable sneaker.  They are soft, have goodarch support and a solid gripping sole.  I walk 2-3 miles a day and these out-perform any other walking shoe.Fit is true to size.  I highly recommend to any who walk or stand on their feet for hours a day."
Skechers,2024-03-29,"Light, supportive, color perfect, and great price. I definitely want to recommend these!!!!"
Skechers,2024-01-08,"I love that these are very stylish looking, and they are so comfortable on my wide feet! They are very light weight, and easy to pack in a bag. I get a lot of compliments on them. I wear a size 6 and that;s what I ordered and they fit perfect!"
Skechers,2024-03-27,I loved this shoe right out of the box. This is my first pair of Skechers and I am very pleased. I work in an office and these were very comfortable right out the box. I wear 11 wide and the fit was perfect -- no complaints at all. I plan on wearing these for casual Fridays or when I know I'll be doing more field work. I also plan on trying more Skecher styles.
Skechers,2024-03-05,"I got these shoes when I was 30 weeks pregnant because none of my other closed shoes fit anymore. I wanted something versatile, cute, and slip-on. These definitely did the job! They are comfy and supportive. I walked around in them for hours on multiple occasions. They stretched just enough to continue being comfortable as my feet got bigger at the end of my pregnancy, and I still felt cute. I would highly recommend these, especially if you’re a momma-to-be looking for easy, cute, and comfy shoes!"
Skechers,2024-03-21,Lightweight slip on.  I bought these at a Skechers outlet last year and the Amazon ones seem much lighter.  Not sure if they will hold up like the others but I like them because they are stylish and easy to slip on and off.
Skechers,2024-04-01,"Nice summer color, very comfortable and fits true to size"
Skechers,2024-03-18,Shoe is just right. Very soft step. Love them.
Skechers,2024-03-23,I work on a yacht and have to wear boat shoes at work. I ordered a few of these in different colors two years ago. They are so comfortable and easy to slip on and off. I just bought another pair because I love them so much.
Skechers,2023-12-15,"I ordered the Skechers Go Walk Evolution (size 12 normal width) online to replace my Costco-purchased cheaper Skechers Memory Foam pair since they are no longer available at Costco.  I became very fond of those Skechers since they were lightweight, breathed well, and were durable for my two daily walks.  As an old retired guy (since 2005), I need daily exercise to keep my health up.Anyway, the Costco Skechers were a simpler version that I needed a hook to put on as they were a tight fit with thinner sides, but that was the way they were made.  The sides were not rounded as these Skechers Go Walk pair.  These cost a bit more but are well worth it since I can simply slip my feet into them without assistance and just ""go walk"".  They don't fit as tight as the Costco ones but they still fit perfectly on my feet.  No side movement or pinched toes -- I ordered the same size as the Costco pair.  Still very light and breathable.  I will only know about the durability after many walks in them, but they do look like they should last for some time.Side note:  I read a negative review where a person faulted the shoe for the way the shoe tended to grip the walking surface.  I assumed that was an old person. Almost any new shoe will do that but most wearers know this and adjust.  However, we older folks (I'm very old) must be very aware of this with any new shoe because we are already prone to falls since we tend not to pick our feet up as well as younger folks, which is why we often trip and fall.Anyway, these Skechers will grip the surface very well so one will not slip easily on surfaces.  That is a good thing for seniors!  But they will need to be aware that they must pick up their feet to step and walk.  Humans are adaptable so if I can do this at my age, I know other old folks can, too.I would recommend these to anyone who wants a lightweight, comfortable, easy-to-wear slip-on shoe.  I will be ordering these again when the pair I have wears out.  :)"
Skechers,2024-04-03,"I have really picky feet, never buy shoes on line, cause most of the times they don't fit and hurt my abnormally high foot instep. This time it worked like a charm, the shoes a re great and a perfect fit."
Skechers,2024-04-09,"I bought these shoes for work thinking they would just be some shoes that I could beat up and not care about. They are extremely comfortable, very breathable, and I got the wide size which gives my toes plenty of room. I was actually surprised by how nice they look on foot and wouldn’t mind wearing these outside of work with a casual fit."
Skechers,2024-03-29,"Easy to put in feet. Comfortable. Everyday casual shoes.My husband normally wears size 14 Extra  wide shoes. We purchased size 15. The fit good, not tight."
Skechers,2024-04-07,"Yes they are great for walking and easy to get on and off. That being said if you do plan on walking in them a lot I recommend getting a half size down because they do stretch out after the first few miles of walking. After that they hold shape and are great for 8ish months of every day walking depending on distance and personal build.  If you want these for casual wear then go ahead and give them a healthy coat of water proofing spray and they will last forever. Not for running you will trip and fall. I have had silver, tan, and olive looking colors and they coordinate well with your clothes. O Yea"
Skechers,2024-03-24,"nothing to dislike . product is good , light and confortable all day long"
Skechers,2024-03-23,"Good fit, sturdy & strong. Extremely lightweight Hardly know they  are on."
Skechers,2024-02-24,"This shoe is similar to the Skechers Go Max walking shoe I have already reviewed.  Similar fabric top with an attractive sheen.  The outer sole seems thicker and built more like an athletic sneaker.  The inner sole provides support in cushiony comfort.  The shoes flex nicely, and my feet do not feel pinched nor encased in a  hard shoe.  Another big plus is they are cold water machine washable and then leave out to air dry.  Honestly, these shoes are attractive and I would not mind wearing them when going out to dinner.  Almost forgot, they come in a variety of neutral shades.  And yes, I highly recommend these shoes!"
Skechers,2024-04-13,"Shoes arrived two day early! Wasn't sure what to expect because the reviews were somewhat mixed but after trying them on for the first time, I was impressed on how stylish they looked and how easy they slipped on. The fit was just right and they felt snug and secure not overly tight. They are definitely light weight and they feel as though they breath nicely so if you take a walk, your feet won't feel like they're over heating. I ordered the ""wide fit"" because I need a bit more room at the sides, so these fit well and were comfortable throughout the day. No need to ""cut the strings"" as another viewer suggested. They were designed well to accommodate most people if you choose the fit you actually need. It's nice to be able to slip the shoes on and off with ease as I am at an age where bending over is not as easy as it used to be. But I suppose it doesn't matter how old you are, these Skechers slip-ons are great for any age if only for convenience. Highly recommend!"
Skechers,2024-04-02,"Extremely comfortable shoes.  Exact to listed size.  Easy to slip on. Look to be well made, time will tell.  As long as they turn out to be durable I would buy again."
Skechers,2024-02-29,"A huge plus of course is not needing to pull these on and just slipping into them.. Great at an Airport or just on the go, takes seconds. Comfort is very good, very light weight, I am a heavy walker not sure how these or going to feel after a few miles under them, time will tell.A Plus feature if you have narrow feet get the regulars and if you need to you can cut the laces and use them to get the desired comfort, tie them off and they fit like a glove now and still able to slip them on and off with zero effort, even when I did this. Loved them so much ordered two pairs, one around the house but I recommend Oofo's for that as well, they are the best if you have Plantar fasciitis.Pros:Very ComfortableDo what they say, slip on with easyNot bad lookingLight weightGreat for short walks so far, haven't tried longer than 2 miles.Perfect for travel, easy to removeCan be adjusted if you have narrow feet ""using laces"". Tying them and still be able to slip them on for a more comfortable fit.Cons:Seemed wider than what I am used to for a regular width.Durability ""Unsure"" about this oneLong term comfort ""Unsure""Thicker Shoe heal for more stability!"
Skechers,2024-03-13,"These shoes are great! Comfy, easy Mr Rogers slip on, and look good! But don’t try to sneak up on anybody as every step with my left shoe sounds like I’m stepping on crumpled cellophane. Don’t know if it’s just my pair or all of them that do this but cat burglars need to avoid these."
Skechers,2024-03-29,"I bought my first pair of these Slip Ins when I was going in for surgery and wouldn't be able to tie shoes for a few weeks. I loved that pair so much, I bought this pair and have been wearing them every day ever since...between both pairs, this is almost two years of wearing them constantly and I am a huge fan. Comfortable, slip on without any issues at all, stays on, are super light, affordable, and what else can you ask for? Thumbs up from me."
Skechers,2024-03-26,"Very nice,very light, super comfortable. True to size.These skechers are good quality I wanted to purchase again but unfortunately they run out.Happy with these shoes"
Skechers,2024-04-03,They're light extremely comfortable very easy to get on and off hands down gotta be the best shoe I've ever worn in 57 years they're so good I bought my 77-year-old father appear because it's easier for him to get on and off also these shoes are incredible I will be buying more of them when need be.
Skechers,2024-04-02,Love the slip in feature. I have nerve damage in one leg and it is painful to put on lace up shoes. These are effortless. Nice colors and style too.
Skechers,2024-04-06,"Very comfy out of the box. Nice style, can be worn with jeans, khakis or shorts. Fit is true to size."
Skechers,2024-03-24,"These shoes were much better than I expected.  Comfort, style and durability were second to none.  I am thoroughly enjoying these shoes."
Skechers,2023-11-10,Very comfortable. They are a bit wide but that’s okay for my feet. Look nice dressed up or casual.
Skechers,2024-04-04,"My daughter said “great shoes, trendy and age appropriate”.  These are my new favorites and I typically buy more expensive shoes.  These go with everything and look good with jeans as well as business casual.  I’ll buy them again."
Skechers,2024-04-09,"I got these shoes as a birthday present for my husband, and he just loves them. They look super cute on him, very flattering and go well with both casual and elegant outfits. He says they're also super comfortable and wants to get them in other colors too. Great purchase if you're looking for stylish vegan sneakers."
Skechers,2024-03-20,"Love these shoes, perfect fit & so comfortable, look good too"
Skechers,2023-10-20,"Ordered the 11.5 W. Build quality, comfy insole, and width were all good. Length felt off and was noticeable longer than my other shoes that are all 11.5 Wides. Too hesitant to try to order a smaller size.Recieved the box from Peltz shoes. It comes with detailed instructions on how to process the return. Felt like they were going to reject it so took lots of pictures before shipping with UPS through Amazon Return process. Delivered in Oct. 18th and return started Oct. 19th so let's see."
Skechers,2023-09-21,"We tried out several shoes this summer for my son and this was the winner. Great shoe for the money. He doesn't have a wide foot but he needs a wider toe box, this shoe worked great. Comfortable and stylish as well as affordable. easy to pack in his luggage and worked with many different types of outfits. This was a great find for him!"
Skechers,2024-02-25,"The extra wide width, well designed shape of and comfortable materials used for cushioning, along with the breathable and attractive looking uppers make this an exceptionally nice shoe especially for wearing all day in clean & dry environments.  For example i use mine mainly as slippers /house shoes however they're great casual wear for walking on smooth & dry or carpeted floors or dry paved surfaces just about anywhere."
Skechers,2021-01-17,"OVERVIEWI found these Skechers Avilo loafers to be quite comfortable, an accurate fit, and an overall great everyday shoe.  Hit the mark on the first buy.  I  didn’t have to make multiple attempts to get the 11.5 US size.  No messing around with delays for exchanges or returns - I appreciate that.  The ratings are representative of the shoe.  I reviewed many of the lower and higher ratings - and I will say I side with the higher ratings.AESTHETICSThe fabric color and texture looks just like the picture, but better. The color name “black” seems off - more like grey to me in the picture - and that holds true to actually receiving it.  I am okay with that.  The color shown in the picture is the actual representation.DURABILITYThe elastic holds the shoe on well for everyday things.  For example, worked outside on moderately grass sloped yard doing yard work for an entire day.  Trimmed trees, hauled branches, walked up and down dried grassy slopes.  Walked on decomposed granite - no rocks stuck in my shoes.  Walked across semi-muddy clay areas without great problem. The shoe did not slip off, not even partially.TRACTIONThe sole worked fine for traction.  Wore them over wet concrete, wet vinyl floor, no slipping.  Wore them on fresh light snow day - no issues.  Didn’t try them on wet glossy tile.  (I will post an update when that happens).  Overall these seem to be rather easy to use.COMFORTFor me, I would like a bit more arch support.  If you tend to pronate (roll-in) the you may want an insert for increased comfort.  But I don’t intend to stand all day on hard surfaces so it really doesn’t matter.  Still comfortable.  They are lightweight and not noticeable while wearing.  They did NOT have an incident of slipping off, sliding off, flopping on the heel.CONVENIENCELove the ease of being able to slip the shoes on without untying and retying just to go do some quick tasks (like take the trash out, mailbox walk).  These have become a part of my everyday life.VALUEThese are a good value.  You get a good shoe for the price.  The quality is there and what you expect from Skechers.  Thumbs up.REVIEWThis review is not compensated in any way, shape, or form.  No freebies."
Skechers,2024-03-10,"They look a little smaller/narrower than my other Skechers loafers, but they fit the same (meaning they fit well).  No heel-slip, no crushing of the toes.  The arch support is a bit flatter than I prefer, but not at all bad.  The build quality for mine are pretty good so far.  I haven't worn them enough to get an idea of wear-and-tear."
Skechers,2024-04-09,"So silly me ran a chainsaw over my bare feet and needed stitches. I was travelling 10 days after ""the incident"" and was worried I would have to be wearing sandals all the time. Nearing the departure time I decided to try the slip-ons just to see if any would be comfortable. SO after the goldilocks experiment I found these to be perfect. roomy enough so that the shoe wasn't resting or rubbing on the wound and having the right length that the shoe wasn't falling off. Like I said - perfect fit. Cinderella or Goldilocks - take your pick. All I know is that Sketchers has a fan for life. Oh yeah, The shoes even as it was enclosed around the toe was more comfortable than the sandals I carried. Yayyy"
Skechers,2023-10-22,"I recently purchased the Expected - Avillo casual slip-on sneaker from SKECHERS® for my husband, and it's safe to say he's absolutely smitten with them! Right off the bat, the design speaks volumes about the brand's dedication to marrying style with comfort. The canvas fabric not only brings durability to the table but also showcases a refined, sanded finish that instantly elevates its look.The Relaxed Fit® design is truly the star of the show. My husband has always struggled with finding shoes that accommodate his feet comfortably, but these sneakers, with their generous silhouette, have proven to be a godsend. The added side goring ensures a snug fit, eliminating the age-old issue of shoes slipping off.What he particularly raves about is the Memory Foam insole. He's on his feet a lot during the day, and these provide unparalleled comfort, making it feel like he's walking on clouds. The shock-absorbing midsole paired with the durable rubber outsole offers stability and superior traction, ensuring each step is secure and comfortable.In terms of aesthetics, the contrast stitching detail adds a touch of sophistication to the sneakers, making them versatile enough for both casual outings and semi-formal events. The ventilated environment, thanks to the soft man-made lining, ensures his feet stay fresh, even after long hours of wear.Coming from Skechers, a brand renowned for its dedication to quality and trend-focused designs, I wasn't surprised by the sheer excellence of the Expected - Avillo sneakers. If you're on the hunt for footwear that doesn't compromise on comfort or style, these are a must-have. From utility boots to lifestyle footwear, Skechers' journey has been commendable, and this product just adds another feather to their cap!A big thumbs up for these sneakers! Whether it's a gift for a loved one or a treat for yourself, you can't go wrong with this choice. Highly recommended! 👟🌟"
Skechers,2024-04-05,"It's amazingly comfy and a great fit, one of the best shoes I ever had. Highly recommended"
Skechers,2024-02-16,"I had an good experience with the Sketchers Slip-On's. The loafers are incredibly comfortable, providing ample support throughout the day. I like their stylish design and how easily they were to slip on and off. The quality is great, and I found them to be very durable for everyday wear. Overall, I recommend these loafers for anyone seeking both comfort and style."
Skechers,2024-04-01,"I was searching for a casual shoe that looks nice.The shoes are amazing, xtra wide, feet perfect.Very comfortable for walking and looks great with long pants or dark jeansThe good part if that they are very cheap compared to other brands"
Skechers,2024-03-24,I was very surprised how great of a buy these were. I chose 10.5 size in wide and they fit perfectly. I’d recommend dropping a half size and if you have a thick foot go with the wide sizes as they seem to run small.  These look and feel great!
Skechers,2024-01-28,Bought these for my son who works out in wet weather.  They were not slippery and very comfortable.  True to size.
Skechers,2024-04-10,"These shoes are a true nonslip, super durable waterproof shoe that really works well in the kitchen. The black is super sharp!"
Skechers,2024-04-15,"Received my shoe order yesterday, so far I am very pleased with the fit and comfort.  Even new, they slip on with ease."
Skechers,2023-09-06,"These are in fact slip resistant, they look professional enough, and their easy to clean. But as somebody who has finicky feet my feet are sore after every day at work, which is 8 hours mostly on my feet. The memory foam squishes down to nothing and brings your feet against a very hard bottom of the shoe.I'm going to replace these with better shoes as soon as I can."
Skechers,2024-04-13,I work 12 hr nursing shifts. This is my second pair. Very comfortable and easy to keep clean.
Skechers,2024-04-06,Skechers are pretty darn good shoes. My last pair lasted 5 years and with my weight running a busy kitchen these slip on slip resistant shoes felt great day one. It’s hard for me to find a comfortable work shoe being flat footed and after spending hundreds on shoes for crews I decided to give these a try. These felt great day one but I think this shoe may run a little small. I wear a 11.5 wide and bought a 12 wide and feel a little cramped. I believe once their broken in they will be just about right and for the price feel way better than the twice the price shoes for crews.
Skechers,2024-03-26,"I have wide feet and have struggled to find a good, reliable work shoe that was comfortable and effective. I wore Keen work shoes for many years which I liked, though there was always an uncomfortable break-in period with them. I decided to give these a try and I'm so glad I did! There was no break-in period at all. Comfortable right out of the box. I've been wearing them for several months now and they're holding up well and still very comfortable. I couldn't be happier with them. Plus at such a great price!"
Skechers,2024-03-28,"Very confortable, sturdy product lTight Fit, which is what I require.Just don't try to sneak up on anyone, they squeek (just a little)."
Skechers,2024-03-27,"I used them 24 to 30 hours every week for my fast food job and they were able to hold up for 8 months. They’re comfortable and have good room; never caused any pain standing all day. It is non slip but you still have to be careful because they could be a bit more grippy. After 8 months, the left shoe bottom has separated"
Skechers,2024-04-02,"I am a longtime user of Sketcher shoes, years! This time however, my high school aged son who is now working at Dairy Queen, needed a pair of good working shoes, that will hold up against slippery floors, water and ice cream falling on them. He told me that these were the most comfortabl shoes he has ever had, and not up against his athletic shoes, but any shoe he has ever worn. I like to think I just made him a Sketcher fan for life, just like I am."
Skechers,2024-01-10,"I do dishwashing / prep for a living and these are essential. I would never walk into a dishroom or kitchen without special nonslip work shoes ever again. Don't try to get away with ""black soled"" shoes or whatever is in your closet. These even kind of look cool in a ""I don't care what I'm wearing"" kind of way. I wear them all the time. The non slip hasn't worn out either. I walk to work in them and to the grocery store, etc. I've had them about 6 months of regular use and they are holding up, sole hasn't come off. I think I bought some gel inserts though. I guess I forgot about that. I would definitely buy gel inserts if you can."
Skechers,2024-03-23,Nice comfortable shoe
Skechers,2024-02-23,"I ordered 14 regular shoes. They fit ok lengthwise,  but they were very wide.  They looked liked wide shoes.  Ugly and looked like they were the footwear of someone substantially heavier than me."
Skechers,2024-04-04,These work shoes always hold up well and are very comfortable I work on a concrete floor 8 hours a day
Skechers,2024-04-16,Skechers is usually my go to for sneakers. I purchased these for an upcoming trip to Ireland & Scotland. I've only wore them around the house at this point but they are very comfortable and I believe they'll hold up well to the 18 rounds in their future.
Skechers,2024-04-16,Good support and a good fit
Skechers,2024-01-18,"Great look, great fit and one of the most comfortable pair of shoes I've ever had!"
Skechers,2024-02-07,Very comfortable shoes and size 10 is a perfect fit
Skechers,2023-12-20,Very happy with quality and comfort
Skechers,2023-05-06,Would like Sketchers to start making this shoe available in US.  Great shoe and comfortable.  I have had maybe 4 pairs over several years and certainly would order this shoe again if they did not ship only from UK as my last order got lost.  I did get a refund and Amazon people were very helpful
