Adidas,2023-08-02,"I love the look, the fit, and the comfort of Adidas shoes. These are attractive shoes, solid, white, with the three burgundy stripes. The only complaint that I have is that they arrived in a white bag with the shoebox inside. The shoebox was completely crushed and mangled. Not so much a problem for me, because it was going in the trash, but for some shoe collectors, the box is just as important as what’s inside."
Adidas,2024-04-07,Great product. I use them for work
Adidas,2024-04-02,Fit perfect great for anyone that wants a comfy cheap durable shoe
Adidas,2024-02-23,"Just what I expect from Adidas... A too quality shoe full of comfort and awesome looks. I have several pairs of Superstars and while I love them, especially for the old school look, these are definitely MUCH more comfortable. I mean, the in-sole is fantastic! Gel and crazy comfortable. I'll definitely be buying more"
Adidas,2024-02-29,"Just got these back after a year hiatus. Perfect shoes for basic, neutral stylin' around town. Pretty much will go well with anything your wearing. The soles are white and will last forever and don't scuff: they wear evenly well. I paid like $10 more at Shoe Carnival 3 years ago, so these are a steal and the price is still going down a week later. BUY these. They look good for at the beach, bar, work/office, airport.. I'm probably end up buying another pair for strictly inside around the house to keep the carpets clean, and one for nights on the town as these have been my everyday walking shoes. Downside is, the whitewalls of the soles of the shoes will show ANYTHING that get up there, so I'll wipe them with a Mr. Clean magic eraser once a week to keep them fresh looking (also, being former army, I know ""if you take care of your gear, your gear will take care of you"" 😋); also another reason I'm buying a pair for around the house, etc. Get them now, they are an investment and will last year's if you keep them clean. Will shrink slightly if you machine wash them. Air-dry with hairdryer or in the direst sun"
Adidas,2024-02-27,"I love these shoes. I thought I’d have to break these shoes in, but they fit perfectly and comfortably immediately. I typically wear a size 11, which is the size I purchased, and they were true to fit. These have a classic style that I can wear as everyday shoes. I’d absolutely buy another pair."
Adidas,2024-03-30,"They look nice and fit comfortably, perfect casual walking shoe."
Adidas,2024-03-03,"The insoles that come with these are barely thicker than construction paper, and offer zero support. Add your choice of quality insoles and you'll have a 5 star pair of shoes. This is the first time I have ever been disappointed in an Adidas product; I remedied the situation but wish I hadn't had to spend the extra money."
Adidas,2024-04-15,"I'm a teacher, so I'm on my feet a decent amount of the day and, so far, these shoes have been amazing. Incredibly comfortable with an almost molded soul, great tread, and stylish looking. I often get compliments from my colleagues and students (who can be very picky with what they like) on my shoes. These are my go to shoes for work or everyday now. Also a plus that it is a well known name like Adidas who has been making quality products for years and years now."
Adidas,2024-03-09,Fits true to size and don’t even have to break the shoe in. Great classic Adidas look. Completely satisfied with the shoes.
Adidas,2024-04-14,"I adore these shoes. For the price, they’re very comfortable and I love the way they look."
Adidas,2024-02-28,"I've been looking for something of a modern style mixed with a classic feel - this shoe is definitely it. It's comfortable, stylish, and i didn't break the bank buying a $100+ shoe. The shoe fits true to size in my experience and i have a wider foot. Would highly recommend!"
Adidas,2024-04-09,These were on sale so I thought to give them a try. Very light weight and comfortable. Had good ground contact and stability. Amazon recommended a half size larger which I did and they fit perfectly. I’m normally a 10.5 in men’s boots and shoes but 11 are just right. These have a really nice look and descent quality
Adidas,2024-03-03,"Love everything about these shoes.Best shoes I have ever owned.Lightweight, comfortable, functional and best of all a great price!"
Adidas,2024-03-19,"This was the first time I had bought this brand of golf shoes. They are very comfortable, and appear to be of very good quality. If I had a complaint, it would be that the soles retain too much dirt and are a little difficult to clean."
Adidas,2024-04-12,"I want to give these shoes a high rating but there is one downside to buying white, mesh shoes. In wet grass of a golf course, they will stain. I've not tried to wash them yet but I can easily see the sort of orange line about halfway up the front of the shoe caused by walking in tall grass (yes, I mean in the tall grass away from the fairway...where I frequently end up).Other than that, they are really good shoes. The gripping base holds the grass well even if it picks up and holds goose droppings and mowed grass.Very comfortable, good fit and very sturdy. I bought a size 14 and it's just right for my size 13 (or so) feet.I don't really pay  much attention to the staining as they're golf shoes and everyone's golf shoes show use.Good product."
Adidas,2024-03-18,"I haven’t yet had the chance to play a film round in them. However, for the price these are insanely comfortable and lightweight and the grip is phenomenal."
Adidas,2024-04-14,Very comfortable and looks great! Awesome price for the value!
Adidas,2024-04-11,"Feel great and have awesome grip on the course! I have a wider foot, and they fit just fine."
Adidas,2024-03-26,Fits true to size. Very comfortable shoe. Good value.
Adidas,2023-10-17,I love the style and fit of the shoe. Everything about them is great except that the insole of the shoe has worn down significantly in the heel and toes. All the way down to the fabric underneath. Other than that the shoes are great.
Adidas,2024-02-04,"Very comfortable. I normally order an 8 in sneakers, but it was unavailable in this color/style, so I opted to try the 7.5. It’s VERY wide around the heel, but the length is perfect. I’m returning them, but if the heel was more narrow, they’d definitely be keepers!!!"
Adidas,2023-01-29,"I love them,but they run too big. I usually wear an 8,but as I read in the reviews they run large I ordered a71/2,but they still big so I reordered a 7 and finally fit,so my advise is to get a number down"
Adidas,2024-03-23,"I’m absolutely in love with these sneakers !I’m wear them often and stay on top of keeping them clean & white.*Tip: Add a tiny bit of water slowly into a paste mixed with Dawn soap, baking soda, oxy clean and/or hydrogen peroxide. Brush on to clean, let air dry ir rinse and let air dry. Can also use a magic eraser on the soles but brushing works great"
Adidas,2023-08-21,"They are very nice, but they are not shoes to wear all day they have no arch support they are very stiff and the tongue doesn't stay flat you have to really pull and tug to be able to get them tied them. They are not for the ladies maybe for young kids . I bought them to replace an old adidas pair and they are not made the same anymore."
Adidas,2024-03-24,"Bought these for the color, style, and manufacturer. They're fine if you don't have to walk on rocks. The soles look thick but you can feel rocks thru the soles."
Adidas,2023-08-18,"Second pair because I love the first pair.  I need a wide toe box with thinner heal, and some arch support in a decent looking shoe.  These fit me so well.  Have tried 7 or 8 different styles this year and none of them fit me well or were cheaply made.  These shoes are very well made, good support with just the right outer sole thickness.  These are 9.5, I wear a 10 in other Adidas shoes.  I am an adidas fan but not impressed with this year's products, except these.  Size down a half size."
Adidas,2024-02-28,Ok so they are white ... I've prepared them with protectant and they are white sneakers. They seem to be true to size ... As they should be. They came on time ... Had to return a larger pair to then get a new pair but that went smoothly.Enjoy!  ~(*¿*)~
Adidas,2023-05-18,"Great shoe - not sure if I would label this a running shoe...maybe a walking shoe.  Casual.  I normally fit 10.5 and needed to get an 11, but worth the price."
Adidas,2023-03-11,A bit narrow but overall fantastic shoe.
Adidas,2023-06-24,"I got a pair of Adidas Nizza shoes for the same price that were very similar to these...at least it seemed. I just wanted a simple pair of white slip on shoes for sunny summer days. They are white, and slip on, but it gets pretty disappointing after that.The band on the side that is supposed to flex is more of a visual gimmick, which makes walking uncomfortable when it's combined with the shoe's unusual tight width.On the bright side- they'll stay clean for longer because I'll barely wear them. Realistically- I wish I had spent $10 more and gotten basic white shoes that I can wear without pain."
Adidas,2023-08-06,"The media could not be loaded.
                



 Decently budget skate shoes which it was made for, elastic band pretty tight but in a skate sesh is manageable. Insole sucks. But the sole of shoe also grips to the board well which is what i want. Not made for walking shoes, get a pair of comfortable running shoes instead of these skate shoes."
Adidas,2024-04-15,I love the shoes. Great fit and great brand. So worth the money
Adidas,2023-08-02,"I have narrow feet and heels usually have problems with shoes coming loose at the heel and ankle area. I purchased these based on some of the reviews that stated that these shoes ran small/narrow. The problem is that the elastic appearing band at the arch of the shoe is actually not elastic and appears to be more of a cosmetic touch. Even with my narrow feet, I had problems getting my foot into the shoe without a fair amount of effort assisted by a shoe horn. The band is relatively rigid and places a great deal of constriction in the midfoot area and along the inner arch of the foot. Once my foot is in the shoe, this constriction is very obvious and yet the heel/ankle area remain loose. This is a very non-anatomically sized shoe. The length appears to be true to fit, its just this midfoot band that is extremely uncomfortable. Also, the sole of this shoe is very stiff. It is not at all flexible unlike what you would normally expect in a casual slip on shoe. I was very disappointed as I liked the cosmetics of the shoe. Unfortunately, I have to say that this is one of the most uncomfortable shoes that I have ever purchased. I should have heeded the negative reviews that talked about how uncomfortable these shoes are. I just thought that it was because people had purchased the wrong size shoe. However, it is the construction and design of the shoe that makes it ill-fitting and uncomfortable. Perhaps that is why they are discounted so much. I have owned several pair of Adidas shoes (in the past they tended to fit well as they tended to accommodate narrower feet like mine). However, this is the first Adidas shoe style that I could not wear (in the proper 8.5 size) due to extreme discomfort. Again, quit a disappointment as I thought that I could snag a “deal” as I really liked the sleek and clean look of the shoe. Will definitely be returning after just trying them on for 3-5 minutes."
Adidas,2023-04-30,These are comfortable but after a few months the insoles are deteriorating. It’s really weird. I’ve never seen a pair of shoes disintegrate like this.
Adidas,2024-03-29,Me gusto mucho por su comodidad
Adidas,2024-04-05,"I did like the comfort and protection for my feet, only draw back my shoe laces broke first time putting them on to tie the shoes. But replaced with white which all I had  but did work for the shoe. Less tired feet have noticed."
Adidas,2024-04-15,Fit was great and are holding together pretty good so farWas concerned about cloth but camp dry to be 100% every now and then and material is holding up better than expected
Adidas,2024-01-31,"They're great shoes, but I'm usually an 11.5 this shoe definitely runs small. Should have bought the size 12. Interesting has I have other Terrex products and fit fine as an 11.5."
Adidas,2023-12-13,"Adidas are the only brand I buy online because I know I won't have any fit problems. I wear a normal Size 10 and these fit as expected. They look cool and they are comfortable. Great traction and no issues so far. I will update this review should I have any issues when I put miles on these.Update 1: This is my second pair of Adidas Terrex shoes. My other pair are Terrex Skychaser LT GTXs. These AX4 are a little bit different. The toe box is a little bit more narrow. Not a problem for me, but keep this in mind if you have wide feet. Also, the sole and heel of the AX4 is much more firm. These are not squishy when you walk or run, but the sole is very supportive."
Adidas,2024-04-02,Great hiking shoe ! Has wonderful traction. Very comfortable and durable shoe
Adidas,2024-03-23,These shoes run small compared to other adidas. I’m typically a 9 men’s which translates to a 10 or 10.5 women’s and these fit super small my feet were hitting the front of the shoe. The shoe has a cool appearance but sadly don’t fit true to size.
Adidas,2024-04-13,Good for walking and running
Adidas,2024-03-17,This is a fair hiking shoe for the price I paid. It's a little snug but got more comfortable as I stretched them out. The black part of the heel has random white specks on them for some reason. For $59.00 it's a fair deal.
Adidas,2024-02-24,Love the ultra boosts. They hold up well. Super comfortable. Slide on and off and hug the feet. Use at the gym and for casual. Old pairs for hiking. Went with a little more color this time. Glad I did. I am typically between an 11.5 and 12. They fit true but the 12 is better for me. 11.5 definitely too snug.
Adidas,2024-03-11,"SOn loved them, comfortable, fast shipping."
Adidas,2024-02-27,would just like there to be a strap that makes them easier to put on like with the Yeezys.
Adidas,2023-11-12,"The shoes get more comfortable as you work them in, however they fit a bit tight around the toes."
Adidas,2023-11-20,"Perfect for running on dry roads.The shoe is a little narrow and squeezes a bit so it’s not the best for regular use.This is my second pair, they are well made and pretty durable if you are using them for it’s intended purpose. Ive used my first pair for 3 years and it’s still holding up.Great looking shoes and color way."
Adidas,2024-02-27,Extremely comfortable. Highly recommend.
Adidas,2024-04-01,Sneakers were already used and then terrible attempt to clean these garbage sneakers
Adidas,2024-02-25,Great shoes. My son wears them everyday
Adidas,2024-03-04,"I bought these because I am a huge fan of the old school Adidas. Not a fan of the new style logo !!! These were as close to old school as possible. Only thing that would have made them better would be the old school original logo on them.  Highly recommend these . Very comfortable, love the look ,fit and the price wasn't bad at all"
Adidas,2024-04-10,"Love, love, love these shoes!!  I was so surprised to feel how comfy these shoes are!  Very cute for that relaxed look!"
Adidas,2024-03-17,Love these shoes! Fit is good and they are super cute!
Adidas,2024-04-10,Love these sneakers
Adidas,2024-04-09,Took awhile to receive but perfect condition
Adidas,2024-03-12,Good fit
Adidas,2024-04-05,I bought these for myself. They are incredibly comfortable. They go with everything. My daughter ended up stealing them so I had to buy a second pair. They are an amazing value.
Adidas,2024-03-28,"Loved this look of these but I ended up returning because they weren’t the right size for me. I needed a wider, larger size. I think these were marked as men’s when I bought them, but they felt like a women’s size."
Adidas,2024-04-07,"These are definitely good running shoes that are very comfortable and well made o durable material. Also very reasonable on the value. I think they run a little small, but overall they are very good shoes."
Adidas,2024-04-10,These shoes look and feel great. Very light and comfortable. True to size.  Fit perfectly.  Will definitely buy these again.
Adidas,2024-03-08,"These are essentially a slip-on shoe, that tighten with the laces.  If you do not have a slim foot, getting yours into the shoe might not be very fun.  Luckily, there are large loops on the heel and what I would call the tongue.  These secure loops allow you to insert something that you can then pull up on.  For instance, I put a large screwdriver through one and a spoon handle in the other so I could pull up on the heel as well as the tongue to wrestle my foot into the shoe.  Once I finally got my foot into the shoe, it felt normal.  It did not feel too tight or uncomfortable.I have now worn the shoe for 72 hours straight as I can not remove it.  Just kidding, I was finally able to get it off with the help of my wife pulling on it like a tight boot.If you have ""chubby"" feet or just feet that are a little thicker than others, I would avoid this shoe at all costs.  Hope this helps you!Cheers!"
Adidas,2024-03-19,My son loves these.  They don't last super long - but that's to be expected; they're lightweight and mesh-like.  They take a beating pretty quickly.  But they look great and they're super comfortable.
Adidas,2024-03-04,"Do yourself a favor. If you have wide feet like I do, you’re going to love these trainers. They fit comfortably from day one. No painful breaking in. No tight ( or hot ) spots. As a bonus they look amazing."
Adidas,2024-03-19,Overall the shoes are great! Little tight on the tongue part only cause it’s not a tongue haha. Would buy again! Green ones look the best!
Adidas,2024-04-10,"I bought these exclusively for the gym based on another review.  They have a firm sole / feel that's good for weight-lifting stability, but they're also comfortable enough for the treadmill or biking.  I don't think I would try to run for any real distance in these though.....JMO."
Adidas,2024-03-19,"These are the brightest white, most stylish, most comfortable goes with every casual outfit shoe I’ve ever owned. Of course it was made by my fav brand. Absolutely love the logo design for the shoe. I will say this is absolutely a shoe that should be sprayed with waterproof spray multiple times before wearing."
Adidas,2023-11-08,"I went back and forth on these for a while before deciding to finally buy them. So glad I did! They are the most comfortable shoes I have ever worn! These shoes wear all day on the course and then to run some quick errands perfectly! No breaking in needed! I wish I had just bought them earlier! They don’t get dirty, they are super comfortable and look great with every outfit! Would highly recommend to anyone on the fence about them. Also, bought my true size and they fit perfect!"
Adidas,2024-01-15,"Love it, very comfortable walking around. Not to mention Cute!!! Pink is more peachy than picture."
Adidas,2023-10-15,Super comfy fit and very clean looking golf sneakers! Not heavy so you can wear them when you walk the course! Easy to clean waterproof! Works great on the course.
Adidas,2023-06-17,I just started golf and wanted a basic golf shoe. I think these are perfect for beginners! They are cute and comfortable. I will say I wish I would have sized down half. I am usually an 8.5 but they are a little loose in the toe and around the ankle.
Adidas,2024-03-05,This is such a good looking golf shoe. It also looks really good off the course.
Adidas,2023-10-07,Super comfy and perdition fit! Love that they can be worn off the course as well.
Adidas,2023-09-09,"Perfect fit, love these shoes"
Adidas,2023-08-16,Great shoes and comfortable! Even for walking the course these were great!
Adidas,2024-04-09,"Great casual adidas shoes. Very comfortable with good cushion and support. I got them on sale for $45 which is a great price for these shoes……frankly what they should have cost considering they’re normally $75! I’m a man and the 9 1/2 fit true to size. I read some reviews saying they were fake or sized wrong, didn’t have problems with the quality or size. Highly recommend."
Adidas,2024-04-09,"I typically wear New Balance cross-training style shoe. I wanted a pair of navy blue suede Converse one stars. I couldn’t find what I was looking for. I bought these and similar style New Balance suede shoes. The New Balance didn’t fit as well as these, so I returned them. These are very comfortable and they look great. Too bad they didn’t have a navy blue suede available."
Adidas,2024-03-28,"Great shoes, right size as described"
Adidas,2024-03-12,"These Adidas VL Court sneakers are satisfying to me. They have a nice, smooth, sleek, and minimalist profile that i admire. I don't like to be too showy with my shoes, and these fit that bill.  They are relatively comfortable also. Their minimalist profile make them easy to use for driving small cars with tight footwells. I wish the uppers were real leather, however, I don't mind them being synthetic since i will use them for everyday use. Now, I can only hope that the uppers don't separate from the soles due to adhesive deterioration as several shoes have done in the past. At this point, i would recommend these shoes to all."
Adidas,2024-04-10,"I love these shoes and haven't stopped wearing them since I got them! They did chafe the back of my foot the first day, but nothing a couple of band-aids couldn't handle. Other than that, they have been very comfortable, and they were also really easy to clean after I got caught in the rain. I should get them in other colors!"
Adidas,2024-04-10,"All that snickers with front tip wrapping up and top made of fabric so borring and annoing. Leather and flat soul , forever!!"
Adidas,2024-01-02,Very nice and fit perfectly
Adidas,2024-04-11,"Fits me perfectly, color and style look great and love how vivid the green is."
Adidas,2024-04-09,We love these shoes. This is my daughters second pair because she grew out of the 1st ones. They are perfect for her feet and true to size. She can walk around all day in these and she never takes them off.
Adidas,2024-02-14,These Adidas are well made. My 8 year old wears them to school a couple days a week between these and her crocs. They still look new and easy to clean.
Adidas,2024-04-06,"ADIDAS toddler sneakers often run small and narrow, but this sneaker fit perfect on my toddlers wide foot.  No more tears while trying to but sneakers on!  Will be buying other styles!"
Adidas,2024-03-23,"These shoes were such a disappointment!!! My son used these for school only and within a week one of the Adidas straps were peeling off. I ended up just cutting it off. I should have returned them, but my son became attached to them and wanted to keep them. I definitely would not buy them again or recommend anyone else to buy them."
Adidas,2024-03-22,My grandson likes them and they look good on his feet and he says they are comfortable
Adidas,2024-02-09,My daughter loves these shoes and says they’re very comfortable. My only complaint would be the laces will not stay ties. They are fairly thick and even a double knot tends to come loose.
Adidas,2024-03-15,This is the 5th pair of this style shoe that I believe I have bought for my almost 5 year old since she’s started walking. Love them
Adidas,2024-03-20,"These are nice except one shoe came with the Velcro not stitched to the shoe so it wouldn’t stay on. An easy fix if you having a sewing kit handy, but just seems really sloppy overall."
Adidas,2023-07-31,"I have been looking for months for a solid white golf shoe, and I finally found the perfect pair!  I normally can wear a size 7.5 in men's shoes, and a size 8.5 in women's shoes.  I purchased these in size 8, and they fit perfectly.  They are listed in men's golf shoes, but they are the exact same shoe as the Adidas Zoysia women's golf shoe, you just need to order a half size down from your normal women's shoe size."
Adidas,2023-08-15,I'm not one of these husbands that plays golf to get away from my wife.  There's no one I enjoy being with more than the lovely missus and I actually have been trying to get her to learn to play golf so we can go to the top courses of the world while we're traveling.  She was hesitant at first but she signed off on the plan when I told her that it would require a brand new wardrobe.Her first requirement was 'cute shoes' which I amended to 'cute shoes that will be decent to play golf in'.  She made it clear that she didn't want anything that looked like the golf shoes at the thrift store which I think are the only ones she's ever seen.  No problem with that here--these are great looking adidas shoes featuring the retro 1990's pale yellow color that has been making a strong comeback.  She hasn't actually started to wear them golfing yet but she loves the way they look and how they fit.  She's a big fan of adidas products in general so they've single handedly made her excited about learning to play golf.  Good job!
